{
  "$schema": "https://json-schema.org/draft/2020-12/schema",
  "$id": "openmontage/artifacts/asset_manifest",
  "title": "Asset Manifest",
  "description": "Inventory of generated/sourced assets produced by the Asset Generator.",
  "type": "object",
  "required": ["version", "assets"],
  "properties": {
    "version": { "type": "string", "const": "1.0" },
    "run_id": {
      "type": "string",
      "description": "Factory run identifier this artifact belongs to (business-documentary pipeline)."
    },
    "created_at": {
      "type": "string",
      "description": "ISO-8601 timestamp of when this artifact was produced."
    },
    "assets": {
      "type": "array",
      "items": {
        "type": "object",
        "required": ["id", "type", "path", "source_tool", "scene_id"],
        "properties": {
          "id": { "type": "string" },
          "type": {
            "type": "string",
            "enum": ["image", "video", "audio", "narration", "music", "sfx", "diagram", "animation", "3d_asset", "3d_world", "code_snippet", "subtitle", "font", "lut"]
          },
          "path": { "type": "string", "description": "Relative path within the pipeline project directory" },
          "source_tool": { "type": "string" },
          "scene_id": { "type": "string" },
          "prompt": { "type": "string", "description": "Generation prompt if AI-generated" },
          "seed": { "type": "integer", "description": "Seed if applicable" },
          "model": { "type": "string", "description": "Model used for generation" },
          "cost_usd": { "type": "number", "minimum": 0 },
          "duration_seconds": { "type": "number", "minimum": 0 },
          "resolution": { "type": "string" },
          "format": { "type": "string" },
          "quality_score": { "type": "number", "minimum": 0, "maximum": 1 },
          "subtype": { "type": "string", "description": "Sub-classification (e.g. 'background', 'stock', 'generated')" },
          "generation_summary": { "type": "string", "description": "Brief summary of how the asset was generated or sourced" },
          "provider": { "type": "string", "description": "Provider name (e.g. pixabay, google_imagen)" },
          "license": { "type": "string", "description": "License type (e.g. Pixabay License, CC0)" },
          "original_url": { "type": "string", "description": "Source URL if downloaded from a stock service" },
          "voice_performance": {
            "type": "object",
            "description": "Applied voice-performance contract for narration assets.",
            "properties": {
              "source_section_id": { "type": "string" },
              "delivery_cues_applied": { "type": "boolean" },
              "provider_text_used": { "type": "boolean" },
              "provider_settings": {
                "type": "object",
                "additionalProperties": true
              },
              "sample_approved": { "type": "boolean" },
              "sample_path": { "type": "string" },
              "review_notes": { "type": "string" }
            },
            "additionalProperties": false
          },
          "author": {
            "type": "string",
            "description": "Rights holder / uploader of the source media, when the provider exposes one."
          },
          "attribution": {
            "type": "string",
            "description": "Exact attribution text the license requires."
          },
          "license_url": {
            "type": "string",
            "description": "URL of the license text or provider terms that were checked."
          },
          "commercial_use_allowed": { "type": "boolean" },
          "modification_allowed": { "type": "boolean" },
          "downloaded_date": { "type": "string", "format": "date" },
          "chosen_interval": {
            "type": "object",
            "description": "The interval actually used from the source clip.",
            "properties": {
              "in_seconds": { "type": "number", "minimum": 0 },
              "out_seconds": { "type": "number", "minimum": 0 }
            },
            "additionalProperties": false
          },
          "sha256": {
            "type": "string",
            "pattern": "^[a-f0-9]{64}$",
            "description": "Hash of the downloaded file as it entered the manifest."
          },
          "search_query": { "type": "string", "description": "The query that surfaced this asset." },
          "selection_reason": { "type": "string", "description": "Why this candidate was picked over the alternatives." },
          "qa_verdict": {
            "type": "string",
            "description": "Per-asset QA outcome (license, media validity, alignment).",
            "enum": ["pass", "reject_license", "reject_invalid_media", "reject_mismatch", "pending"]
          }
        },
        "additionalProperties": false
      }
    },
    "total_cost_usd": { "type": "number", "minimum": 0 },
    "metadata": { "type": "object" }
  },
  "additionalProperties": false
}
