{
  "version": "1.0",
  "assets": [
    {
      "id": "diagram-scene-2",
      "type": "diagram",
      "path": "assets/images/scene-2-chloroplast-diagram.png",
      "source_tool": "diagram_gen",
      "scene_id": "scene-2",
      "prompt": "flowchart LR: Sunlight → Chlorophyll → Light Energy inside Chloroplast; purple/teal flat-motion-graphics palette",
      "cost_usd": 0,
      "format": "png",
      "generation_summary": "Mermaid-style flowchart rendered via diagram_gen (Pillow fallback; mmdc not on PATH)",
      "provider": "mermaid"
    },
    {
      "id": "music-bg",
      "type": "music",
      "path": "assets/music/background_music.mp3",
      "source_tool": "pixabay_music",
      "scene_id": "scene-1",
      "duration_seconds": 119,
      "cost_usd": 0,
      "format": "mp3",
      "subtype": "background",
      "generation_summary": "Pixabay royalty-free search: upbeat educational soft synth",
      "provider": "pixabay_music",
      "license": "Pixabay License"
    }
  ],
  "total_cost_usd": 0,
  "metadata": {
    "generation_summary": {
      "narration_sections": 0,
      "images_generated": 0,
      "diagrams_generated": 1,
      "music_tracks": 1
    },
    "blockers": [
      {
        "asset": "narration",
        "tool": "openai_tts",
        "status": "blocked",
        "reason": "OPENAI_API_KEY is not set in environment or .env",
        "impact": "Cannot generate 30s voiceover for approved explainer path",
        "options": [
          {
            "id": "set_openai_key",
            "label": "Add OPENAI_API_KEY to .env (recommended, ~$0.05)",
            "recommended": true
          },
          {
            "id": "install_piper",
            "label": "Install Piper local TTS (free, requires setup)",
            "recommended": false
          }
        ]
      }
    ],
    "pending_assets": [
      "narration-s1 through narration-s5 (OpenAI TTS, voice ash)",
      "TTS sample for script section s1 (sample_approval_required)"
    ],
    "music_status": "available"
  }
}
